{
  "schema_version": "intake.ocr-request.v1",
  "request_id": "50000000-0000-4000-8000-000000000001",
  "consumer_id": "10000000-0000-4000-8000-000000000003",
  "logical_id": "20000000-0000-4000-8000-000000000002",
  "variant": "crop_bottom",
  "preset": "bottom_42pct",
  "reason_code": "truncated_footer",
  "observed_revision": 1,
  "submitted_at": "2026-09-24T08:01:00+07:00"
}
